aafkagh	to burst
aafqugh	to set things aside; to divide things into groups
aafte	to separate from others
aaga	to swing
aageste 	to prolong one's action for a long time; to moan long and mournfully 
aaggaatae	whetstone; sharpening stone
aaggagh	to sharpen; to whet
aaggnaqe	to use sparingly; to economize
aaghhaghte	to move a little by force; to budge; to change one's mind; for there to be an earthquake
aaghhe	to move freely (as a rope being pulled, or a person's behavior); to slacken
aaghhneghlliqe	to be stubborn
aaghhneghlluk	one who is hard to convince; stubborn person; skeptical person
aaghhutagh	to move by crawling over thin ice
aaghhwe	to crawl
aaghqaghte1	to take a route different from usual; to detour; to avoid; to evade; to put rope around or across something
aaghqaghte2	to urge; to encourage
aaghqutaate	to detour; to decide for someone without giving him a say
aaghqute	to comply with the wishes of another
aaghsi	thong holding shank (giimaq) to harpoon shaft
aaghte1	to move a little; to budge; to change one's mind; for there to be an earthquake
aaghte2	to convince
aaghtiiraagh	to argue
aaghwqe	to get bloody
aagneghaghte	to split at the crotch
aagneghtu	to have long steps; to have a long stride
aagtagh	to shoot at even though from a distance
aagte1	to prolong one's action
aagte2	to stumble; to trip
aagte3	to keep something secret; to let something pass without mentioning it
aag	to take a side trip
aagute	to bump into something; to make a side trip for (it)
aagyugniqe	to be stubborn or persistent
aagyugteste	to make (him) stubborn; to provoke
aagyugutke	to pick on
aalma	block of snow to be used in a heated house
aanesqe	to drive out; to expel; to force somebody to leave
aanestaghagh	to press or squeeze out; to put or thrust out
aane	to go out(side)
aangaayugte	to act as if superior to others; to put on airs; to act conceited
aange	to be big; to be large
aanghuute	to spark as from friction; to make sparks
aangqagh	to play ball
aangqasiigh, aangqasi-	to get ready to throw a ball; to "wind up"
aangwaagh	to be rather big,  big enough
aanighte	to concentrate thought and action on what one is doing
aanleghaate	to leave a building; to rise to the surface
aanleghagh	to seep out; to flow out
aanqaghte	to rush out; to protrude; to bulge
aanqaghtivike	to hit accidentally as with a stone from a sling
aanqutagh	to lead singing
aanqute	to start singing or speaking
aante	to to take out; to bring out; to put out; to give birth to
aanyaghagh	to go out early
aanziigh	to burp; to belch
aapghun	object which is to be sacrificed; prediction
aapte	to ask
aapute	to ask permission; to ask concerning someone or something
aarragh	to dress in fancy clothes
aasliigh	to patch a skin boat
aastu	to be wide; to extend far
aate	to put on (clothes); to dress
aatghute	to go out hunting on foot on the ice
aatneq	slope near the beach; small portion of land extending out into the water
aatqaghtagh	to suddenly and quickly go out (as from room)
aatqaghte	to slip or jerk when working with something by hand; to run off the road; to deviate from the desired path
aavgaghte	to split open suddenly; to get injured severely on the surface of one’s body
aavgugh	to cut up thoroughly
aawhkagh	for spring to come
aawhtuqe	to bleed
aawhtu	to be bloody
aawiite	to lose blood
aawite	to be bloodless
aaw	to bleed; to menstruate
aayiiq tanem	preliminary incantation; call to a certain spirit
aaykagh	to gamble
aflaaghaghte	to interrupt
aflengake	to take care of (valued possession or person); to keep
aflenga	to be thrifty; to take good care of one’s things
aflute	to feel sorry for; to sympathize with
aflu	the span from one thing to another (as from one hour to the next); thing between two others (as a child born between two others)
afsengaghpak	muskrat (Ondata zibethicus); beaver (Castor canadensis)
afsengaghqe	for there to be the squeaking sound of a mouse
afta	to cut up game; to butcher game; to have surgery (additional Chukotkan meaning)
agaavik	double hook used to fasten caught walrus to side of boat
agaghtiiraagh	to hang; to be hanging
agalghu	to stagger
agangsitagh	to stay away
agenriqe	to think carefully about something
agepsugh 	to be smoky
agesngughte	to kill instantly (especally by hitting on bridge of nose); to knock out (?)
agghi	to confer; to decide
agghiyugniqe	to be spoiled; to be obstinate
aghaligh	to treat with medicine; to medicate; to put on an amulet
aghallegtaq	doctor
aghanghuuraq	amulet attached on to belt or clothing;  medicinal plant sewn on to animal skin and attached to one’s belt
aghelqute	to move a little (of something heavy and/or tight); to budge
aghhmagte	to take all; to use all
aghinghwaaq	small bag of sealskin holding certain articles used to try to ensure good whale hunting
aghinqagh	to wet
aghipate	to be wet; to be raw
aghipsaate	to be partly wet; to be partially raw
aghisigh	to soak
aghi	to be wet
aghitqe	to get very wet
aghiva	to quarrel (of women); to bawl out (by women)
aghmig	to wash one's face
aghnaaghte	to have one's first menses
aghnaghniite	to be ugly (a girl)
aghnaghpallaghte	to become an older woman
aghnaghqaq	wifeto-be; female to be included in a group; dress material
aghnagh	to wear a dress
aghnangllagh	to make a dress; to ask to marry (of an older man asking a woman on behalf of a younger man)
aghnapesqighte	to sit (in woman’s traditional style)
aghnaqemsighte	to sit (in woman’s traditional style)
aghnaqe	to be proud in a way appropriate for a woman
aghneghmi	today; during the daytime
aghneghniimna	the one from earlier today
aghneghtaq	the one from earlier today
aghneghte	to spend the day
aghneghtughte	for the days to get longer
aghneq	day; today (as a particle)
aghnequn	this afternoon; later today
aghneqwaaqun	a little later today
aghni	to spend one or more days; to stay an extra day while travelling (usually, in order to rest)
aghpugte	to rise (of dough  or the like); to swell
aghpumla	to go through deep snow
aghpuneq	gas in stomach or intestines
aghqe1	to make an offering of food for the deceased
aghqefik	place for making food offerings to the deceased (traditionally); altar
aghqella	to fish with seine
aghqelli	to lower; to make lower; to become shallow
aghqeme	to crumble; to shatter; to become envious
aghqengwaagh	to make a sacrifice
aghqetghagh	to crust over (of snow); to travel on crusted snow; to freeze over (of surface of snow)
aghqiiwhtagh	to make a crunching sound
Aghqitaghangha	southern part of Troutman Lake which is next to Gambell
aghqutite	to make sacrifices
aghquugte	to be pale from illness
aghquutke	to cause disaster or hardship
aghquvlug	to make a depressionor dent; to hollow out
aghsaan	excessively; overly; too much; not very much
aghsaghmete	to be good weather; to favor; to pay particular attention (good or bad) toward (him)
aghsaghtaghwaagh	to give up or quit from malice or out of vexation
aghsaghte	to overdo; to behave in an excessive way; to annoy
aghsi	thong holding shank (giimaq) to harpoon shaft
aghsugh	to be or become pale; to be or become bleached
aghsug	to put (a baby) down to sleep
aghsugutaq 	crib for baby to sleep in
aghtaghagh	to become light
aghteqeregagh	to snack on roots or greens with blubber and raw meat
aghte	to dawn; for day to break
aghtugh	to be unable to manage, bear, withstand or accomplish
aghulaghqugh	to go to gather edible greens
aghulaghwaagh	to fly, flutter, or sway
aghulaqe	to leave
aghulate	to shake
aghula	to dance Eskimo-style; to shake (as to wake up a person); to move back and forth (as of something hanging)
aghuliigh	to stop moving
aghuqe	to distribute shares of a catch; to distribute gifts
aghu	to rot; to (over)ripen; to decompose
aghvaq	bright sky seen in the distance along the horizon and indicating good weather to come
aghvenge	to catch whale
aghveqaghtagh	to hunt with bolas
aghveqenghaq	a few whales swimming together
aghveqe	to harpoon (a whale); to strike (a whale)
aghveqe 	to have shingles, the disease – Herpes zoster
aghveqi	to strike a whale
aghvequte	to fall forward hard; to plunge to the ground from a height
aghveyugagh1  	to be semicircular
aghvighqun	rope that is attached to the bottom of the keel and the side of a boat for stability
Aghvightek	projection of land into lagoon from near the center of the barrier isthmus of Koozata Lagoon on St. Lawrence Is.
aghvigh	to go across; to cross over; to leave St. Lawrence Is. for Chukotka
aghvig	to wash clothes
aghyanegh	to hurry; to get ready fast; to rush
aghyanghute	to rush around
aghyaniqe	to rush around
aghyughsigh	to age food as a means of storage and/or preparation
aghyugh	to get old; to age
aghyuqe	to be homesick; to be tired of (it/him)
aghyuugh	to scold; to spank
aghyuuniigh	to scold someone
aghyuutagh	to be strict
agigpughagh	to peek in; to look down from the top 
agigte	to peek over; to look around from a vantage point; to go to a high point 
agitagha	to yawn
agivike	to take one’s share of the catch to one’s inlaws when one is a newlywed man
aglagh	to go home; to go from one place to another
agleghnagh	to be sacred
agleghu	to follow traditional abstinence practices
aglughtaq	mast step of a boat; clamp holding sail to mast
aglug	to rummage
aglungqaghtagh	to have chattering teeth
agnigha	to be undecided; to hesitate
agniigh	to flow steadily
agniqe	to be mad, angry  or furious (of a woman)
agtugh	to touch lightly; to come into contact; to contact
agughpagtagh	to warp; to become crooked
agvate	to return to one’s upbringing (?)
agzighte	to stubbornly and sullenly delay in doing what one has been told to do; to be unresponsive when someone tries to awaken one
ahay	what? yes? (in answer to a call)
akagte	to clean; to scrape clean (skins and the like)
akamkegsagh	to make (it) round
akemna 	that one way over there; that one outside of Alaska or outside of the St. Lawrence Island area of Alaska; that one toward the southeast
akeqe	to promise
akeqsagte	to threaten
akfigh	to attach a strap to a bag to use over the shoulder
akigh	to support; to brace; to prop up
akiingqwaghte	to echo
akike	to sell; to trade (exchange)
akikugh	to sell
akileghtugh	to pay; to reward
akilghuu, akilghuugh-	to yell; to scream; to use a loud voice
akilguqe	to price high; to put a high price on something
akilpegagh	to shop; to engage in trading
akilpegaghvik	store
akimsuggiite	to be very cheap
akingite	to be cheap; to be free; to be inexpensive
akiniigh	to raise objections; to sass; to retaliate
akiqagh	to fend off (as with the hands) something that is coming at one
akiqu	to sass back
akisqaghte	to shine light; to flash light; to reflect light
akite	to reciprocate; to respond; to answer; to take revenge
aki	to reciprocate; to retaliate
akitukneghu	to be stubborn
akitutaligh	to estimate cost or value
akivigte	to prop up skin boat on its side
akluma	to be poor
aklunagh	to be rare; to be scarce
aklunghighi	to become rich; to become wealthy
aklungite	to be rich, wealthy
aklu	to be in need; to lack something
akmag	to backpack; to carry on one’s back
akneqaq	protrusion or projection to keep something from slipping
aksaqe	to keep a secret; to hide something
aksig	to paddle with an oar outward from the boat so as to make it turn
aksigu	to adjust the wick and flame in a seal oil lamp
akughaghqagh	to pick roots
akughqun	something to be eaten
akughte	to apply water; to mix seal oil and blood; to dilute; to soak
akughtugh	to stretch one's hands or arms to reach; to reach out
akughtu	to be long or too long (of garments); to have long roots
akughun	dish filled with water that is used to moisten a drum after a shaman’s seance
akuliite	to position or place in the midst; to infiltrate; to mix in
akullghute	to mix or become mixed into a crowd or mass
akullute	to jumble things; to mix things up
akulpeghte	to add something in the middle
akultughte	to become farther apart, less frequent, or less crowded
akultu	to be far apart; to be widely spaced
akume	to put sugar or other things in; to add extra ingredients
akumighaghtagh	to interrupt other’s talking
akumkaghqaq	ingredient to be added
akuqagh	to grab; catch; to accept a decision or an offer quickly
akusqaghtaq	rumor; news told before it becomes certain
akusqaghte	to spread a rumor or news before it becomes certain
akuuraate	to be there when something happens; to arrive on time; to be in the right place at the right time
akuuragh	to be at the same place or same time
akuute	to mix; to knead
akuzilqusiigh	to make sharp remarks
akuzimleghagh	to whisper
akuzipig	to speak Yupik
akuzite	to advise; to urge; to try to persuade
akuzi	to speak
akuziviighqe	to scold without good reason
akwaangigh	to increase in volume or number or frequency
alaaqitke	to get something and then lose it right away
alaghuutaghte	to have a premonition; to expect something to happen
alamkae	partition between compartments of a ruminant's stomach
alamsa	to want to eat more
alaqitke	to lose game right after catching it
aleghqugh 	to speak to someone; to advise
aleghquma	to stay with a companion; to keep company
aleghqumseghagh	to whisper; to joke; to tease; to speak lightly (in any sense)
aleghqumsug	to chat; to gossip
alemeng	but; on the contrary; contrary to what has been said
aleveghte	to want more
alevegh	to want more food
alghapaghagh	to walk side by side with (him)
alghapagti	to walk side by side
alghigh	to repeat; to do for a second time; to accompany
algumake	to covet
alguma	to covet something; to want more (food or the like)
aliftugh	to miscarry
aligake	to long to go to
aligate	to strongly wish to go
aliga 	to long to go somewhere or to see someone
aligavike	to long to go to
alignaghtaagh	to perform supernatural acts through shamanism
alignaghtagh	to have shamanistic powers
alignagh	to have shamanistic power; to be a shaman
aliighagh	to keep one's hands inside his parka sleeves
aliighte	to reveal; to show; to bring into view
aliigh	to appear; for weather to clear up
aliiqaqu	to be intermittently visible or audible; for weather to be intermittently clear
aliisigate	to be invisible; to be inaudible
aliite	to be visible; to be audible
alike	to be afraid of (him/it); to fear
alingengite	to be fearless
alinge	to be afraid; be scared
alingnagh	to be frightening; to be intimidating
alingruugh	to be terrified; to panic
alingseghagh	to try to scare; to purposely frighten
alingsequ	to make a threatening gesture
alingtagh	to be cowardly; to be habitually fearful; to be unduly cautious
alingtiiritaq	amulet; good luck charm; charm put near entrance of house to protect  inhabitants
alingughagh	to wince; to flinch
alingughyug	to cower; to be timid
alingutke	to be concerned about; to worry about
alingyug	to be fearful or apprehensive
aliq	sleeve; leanto storage room on side of house
alkwaagh	to cover or be covered (by a large number or mass of objects)
allaghqi	to make a mistake; to err; to say or do something unexpected
allaghquute	to miss hitting the spot aimed at; to arrive earlier or later than planned
allakaghte	to separate oneself from the others
allakagh	to become independent (of one’s family, or the like)
allake	to find (it) different or unfamiliar
allakunginagh	to get confused; to go haywire
allangughte	to change; to become different
allaniigh	to commit adultery
allayug	to feel strange or out of place
allegek 	shaman's broom used to "brush off"  illness; dumping place for lamp sediment or disease
alleg	to sweep; to brush off
allegvike	to infect
allegviknagh	to be susceptible to contagion
allgegh	to appear; to emerge; to be born
allghiinegh	to be disobedient; to be capricious; to follow one’s own wishes only
allghuu	to be the first boat that comes to aid a boat that is catching a whale
allighagh	to prepare a bed
allighsiigh	to make socks
alligte	to remain in an obscured place; to go and not return; to stay away too long
allngig	to sew a patch onto a boot sole
allngughte	to tan (a bird skin) for use
allngugh	to submerge; to dive under water
allughqi	to adopt (a child)
allumyagte	to act on (it) almost but not quite in its entirety; to get the most out of what is available; to have done most of what was to be done; for most of what was to occur to have happened
allungak	bottom or base part of a container
allungelquq	ice pan (an early winter ice formation, circular or oval in shape, with edges too thin to support walking)
allute	to act, or act on (it), entirely or almost entirely
almesiqe	to be as expected; to stay the same
almesiq	old custom; tradition
alngunaghqe	to act carelessly
alngunaghqute	to jumble things; to mess things up
alngunaseghagh	to act carelessly
alpag	to pass through (an obstacle, physical or otherwise); to go through
alqimagh	to lick; to taste
alqimsug	to snack
alquutagh	to use a spoon
alunge	to lap with the tongue; to lick
alungragh	to repeatedly lap; to lick paws (of a dog)
alwinanga	broad knife, similar to a scraper, on a long shaft, used for butchering whale in the water
amaaghaq	baby bird; auklet chick; person who is too young for a given situation (slang)
amaamighute	to be in line with each other in someone's sight
amaghagh	to continue to carry on one’s shoulders
amaghan	rope attached to harpoon
amaghte	to criss-cross
amagh	to carry on one’s shoulders
amaghtugh	to throw  down (in wrestling)
amagyuk	line down the middle of something; line down the back of a whale from the midarea to the fluke
amakesegaagh	to carry piggyback
amaqe	to carry on one’s back
amaseketaagh	to carry someone on one’s back
amellayi	to become or make narrow or thin; to slim down
ameltu	to be wide
amen	then; there; but come to think of it, yes (indeed)
amghute	to not leave anything for others
amgusigh	to tie one thing to another
amigh	to put skin on (a skin-boat)
amiigigh	to fence off; to block
amiin	ice formation extending from sea ice over the shore to which it is frozen; ice that stretches from a floating or fast iceberg
aminakuq	open water left in newly formed sea ice fields due to gaps between the floes that join to form the fields; small patch of open water in heavy ice or the ice that surrounds open water
aminakwaaq	leftover
aminaqe	to leave some for someone
amisiiq	a game in which a village is divided into two teams, each trying to outrun the other around the village
amlleqngiitigh	to squeeze something between one’s knees
amllugh 	to take a step (over)
amqeghpagte	for ground to freeze
amqeghqugh	to bite repeatedly
amqeghte	to bite
amqegkagh	to nip
amqute	to take a bite of something
amsanagh	to be calm (weather)
amsighqe	to mend by sewing
amsungisaq	minke whale (Balaenoptera acutorostrata)
amugite	to have good eyesight
amugnagh	to inhibit sight
amugtagh	to have trouble seeing
amug	to be unable to see
amu	to pull through an opening (of thread, rope, etc.)
amutughqe	to sew quickly
amuugte	to lose one's sight
amyughaagh	to tease (between cousins)
amyulqe	to make fun of someone
amyume	to waste or squander
amyuqetaghta 	persecuter; tormenter
amyuqetagh	to be cruel
amyuutke	to be cruel to (him) or over (it)
anaavag	to use a net on a pole to catch birds
anaggute	to be mixed up; to be confused; to do things wrong
anaghnigh	to stink; to smell spoiled
anaghtaa	to rust
anagh 	to defecate; to rust
anagnga	to be incorrect; to be wrong; to be provoked
anagniigh	to be in the act of fleeing or escaping; to be on the run
anagte	to miss the mark; to confuse (get one confused); to irritate (a person)
anagtii	to miss the target; to commit an error; to do wrong; to break the law
anag	to flee; to escape
anagu	to strike with a stick
anagyaq	person who seems fated always to escape from dangerous situations; born survivor
anangugh	to escape (especially from hardship)
anate	to raise; to nurture
aneghneghiite	to get out of breath
aneghneghte	to do something that turns out well; to choose well
aneghrengi	to be extremely pleased with a new possession or other thing just obtained
aneghte1	to breathe
aneghte2	to continue to be or to function as one has; to repeat one’s actions
aneghziig	to exhale softly, slowly and deeply
anekestagh	to crawl out quietly to the open space 
an'gaghigh	to give gift to newborn baby
angaghqe	to convey; to take along; to transport
angaghqugh	to keep on transporting things
angalke	to jerk on a tether or other restraint to get free
angalqatagh	to hook a caught seal to retrieve
angatughqe	to hurry over (it) (especially at sewing)
angeghpayug	to perk up; to feel revived, strengthened and encouraged
angeghqe	to agree upon; to approve of
angeghrugte	to be a determined person
angegh	to affirm; to assent; to agree; to say "yes"
Angetequq	former village west of Cape Stoletia in Chukotka
anghungite	to eat greedily; to gobble food; to use things up fast
angighhe	to smear; to rub in; to spread; to paint
angighhwaagh	to spread (paint, ointment, etc.) especially repeatedly over a small area
angighte	to become warm
an'gigh	to go or be outside to get fresh air
angiite	to arrive on time; to finish on time
angilaagh, angitaagh-	for water to be calm in a cover
angiqe	to undo; to untie; to unravel
an'giqragh	to be outside for no real reason
angi	to come undone; to unravel; to come unfastened
angkaliigh	to become the size of something
angka	to be a certain size
anglaminagh	to be beautiful or colorful
anglanagh	to be beautiful (of sounds); to be delightful to hear
angli1	to grow; to become big
angli2	to make a hole in the ice
anglii	to make a hole for ice-fishing
anglime	to be spectacular; to be resounding
anglinasug	to grow slowly
angqa	hip; thigh; person from a house located to the side (of this one or of ours)
angqigh	to be in pain
angtaliite	to grow to full size
angtughte	to catch something (game) that is big
angufqaghte	to be stormbound; to be weathered in
anguksag	to get caught in a storm while traveling; to deal with mischievous people; to encounter unexpectedly; to be at a place or time while something is still there
angulegh	for waves to overtake one
angulgha	to move slow (of liquid, especially the tide)
angumaaghwagh	to linger in one’s poor condition without improvement; to continue as is (of person or condition)
angumaasitaagh	to search for something lost; to put effort in order to take, gather, eat, etc. more than others
angumaaskitaagh	to hurry in order to not miss something or to finished in time
angumaasqitaghte	to be delayed
angumake	to catch up with a person; to get to an event before it is over
angumatkenghite	to miss (as by not getting somewhere in time for something)
angu	to overtake; to catch up with
anguugh	to be stormbound; to be delayed by unforeseen circumstances
anguyiqe	to pick a fight
angvagte	to overreact to discomfort or pain; to act spoiled; to feel sorry for oneself and show it 
angvigagh	to be tall (of a person); to be taller
angwaagh	to paddle
angyaataghqe	to eat boating food
angyaghllug	to use an ice floe as a makeshift raft to cross open water
angyaghnaq	for there to be good weather for hunting by boat
angyaghniigh	to hunt with a boat; to ask for a boat
angyagh	to use a boat; to travel by boat; to hunt with a boat
angyaghugh	to take an unplanned boat trip or side-trip
angyalligh	to steer a boat
angyeghnak	alaska blackfish (Dallia pectoralis)
angyii	to hover over something; to circle over something
angyilghagh	to put on a boat rack
angyilghaq	rack for storing a boat
angyiqe	to trouble a boat (of a whale playing directly under it); to play under the boat
angyite	for there to be many boats out in the ocean
angyi	to make a boat; to play under an overturned boat (of an animal)
anighaaghte	to act (on) more than before or as much as possible
anighqun1	torch; fire starter; lighter; candle
anighta	it used to be (wishfully or nostalgically)
anighte	to make up one’s mind; to stay a certain way; to be determined
anigullugte	for snow to be soft and melting (as in spring)
anigulluugte	for snow to be soft and melting (as in spring)
anigungiite	for snow to haved melted or evaporated and disappeared
anigusiigh	to cut blocks of snow for melting into water
anigute	to be snowed in
aniighqwaa	to get or be red-hot
aniighwte	to get or be red-hot
aningugh	to escape from; to struggle through; to wait out
aningwaagh	to get a boil
anpaghqe	to speak or sing loudly (of men); to raise one’s voice to emphasize what one is saying
anughaqe	to train; to exercise
anuqataghaaghte	for wind to pick up
anuqeghrukutaaghllak	hurricane or similar storm
anuqligh	to get or be windy
anusigaa, anusiyaa-	to be tired of something that is annoying or painful
anusimighte	to not want to repeat one's actions due to having seen their consequences; to have "learned one's lesson"
anusimingllagh	to punish
apaate	to estimate size; to give directions; to set the price of something
apagh	to beckon; to gesture to come
apallengya	to cry and fuss without reason (of children)
apapaagh	to give food in honor of a new baby (given by baby’s parents going house to house)
apapaaghusiq	gift of food in honor of new baby given by baby’s parents going house to house
apaqaqu	to give order(s); to be in charge of; to gesticulate
apaqu	to direct; to instruct; to gesture
apegh1	to tell; to confess; to tell on or about
apeghiighsagh	to get ready; to prepare
apeghiigh	to finish; to complete; after ––
apeghragh	to betray; to give secrets away
apeghtugh	to teach
apeghyagh	to get something ready; to finish something
apenglleq	small pressure ridge in sea ice field; ice pieces or pile on top of pressure ridge
apengqe	to get stooped over (as from old age); to be folded over
apengte	to fold; to shorten by folding
apenqigte	to repeat; to say again
apetuyuugte	to hesitate; to give an excuse
apghusiigh	to hesitate and/or give an excuse; to be unenthusiastic; to be uninterested; to be unfavorable (of weather)
apumgute	to thrust or throw into soft snow or dirt; to plunge or bury oneself in soft snow or dirt
apunaqaqe	to request permission to be absent
aputiisaq	gift; donation; meat given to someone near the site of butchering or met along the way
aputite	to give harvested or hunted item to (someone met near site)
aqapetug	to flap wings while remaining stationary in midair; to hover (bird)
aqayamaawi	to take a long time to heal due to repeated trauma
