aafkagh	to burst
qiiqw2	cough; cold (respiratory illness)
qiivaqu	to turn one’s head side to side and look around
qiive	to turn body or head; to make a turn while traveling; to turn toward someone for help
qiiyngu	to decorate with a kind of needlepoint done with long reindeer hair from under the chin
qikeghte	to bend
qikighqe	to become bent; to become crooked
qikighqugh	to set (a saw blade or the like)
qilaget	patterning of tattoos on the cheek
qilagigh	to become overcast; to become cloudy
qilaglluuk	dark storm cloud
qilag	to make a net
qilghake	to be annoyed or irritated over (it); to criticize
qilgha	to complain; to be annoyed; to be irritated; to be critical
qilghayagute	to become irritable
qilghayug	to be irritable
qiliighnagh	to be desirable
qiliigh, qiliighyug-	to covet something; to desire something
qiliiqe, qiliighyuke-	to covet (it); to desire (it)
qilleghte	to tie
qilleghtuqaq2	knot at tend of rope to keep it from unraveling or slipping off  something
qilleghvikuusaq	string with beads tied formerly onto new or special objects
qilug	to bark (of dog)
qimagraa	to be on the run
qimag	to flee; to run away
qimagugh	to repeated run away
qimugilnguq	hunter, from whom a wounded animal does not escape (according to folk belief)
qimugsigh	to travel by dogteam
qimugtagh	to take a pup on a training run
qimug	to be trained (of a dog being trained for sled use)
qimuke	to pursue (it) as a game animal
qineghpeghwaagh	to look at with telescope or binoculars
qineghpugag	to look at with telescope or binoculars
qineghte	to look (or look at) through an opening, a window, door, sight, scope, etc.
qingagh	to be persnickety (e.g. over food); to reject something (often food)
qingaghwiqe	to become unpredictable, wild and hazardous
qingakute	to stay away from others; to keep away from trouble
qingakutke	to avoid trouble
qingaqe	to reject (it - food); to find (it - food) distasteful
qingragh	to conceal; to run away
qingrag	to get away from annoyance or disturbance
qingsig	to look aside at something; to glance at something; to glance at something
qingsugaghte	to get a hangnail or broken fingernail
qingwaangite	to disrespect the ownership rights of others
qinuke	to be annoyed with; to lack interest in; to be bored with; to be disinclined to do (it)
qinunaghqe	to tease; to pester; to provoke; to bother
qinu	to be annoyed; to be disinclined to act
qinuyagute	to tire of (it); to begin to find it wearisome
qinuyugte	to pester
qinuyug	to feel overwhelmed by the tasks facing one; to get sick; to feel irritated from being pestered
qiperutaagh	to twist repeatedly
qipesqinghaaghte	to soak too much (of boot soles)
qipesqinghaghte	to be overly soaked (of skin-boot soles being soaked before shaping)
qipleghaghte	to break by twisting or being twisted too much
qipleghte	to stir; knead; to shake up
qipugh	to wind a clock, watch, etc.
qipugute	to mess things up
qirpaawi	to be eager and enthusiastic; to exert effort in order to finish a task (despite difficulties)
qisemna	whetstone; rock used as whetstone; sharpening stone
qitegh	to beat one's wife
qiteve	to speak a language different from Yupik; to jabber; to speak Chukchi
qivagnaq	bold person; one who isn’t shy and who doesn’t hesitate to do anything
qivallekeltaq	low pressure ridge but still difficult to walk across
qivalluk	large pressure ridge, hard to walk across (requires climbing up and down); sea ice that has not leveled off and has lots of pressure ridges
qivesnagh	to change direction repeatedly; to turn every which way
qivghuke	to feel bad about (it); to feel sorry about about the loss of (it)
qivghuli	to cause someone to feel bad (especially over a loss)
qivghunagh	to make one sad; to cause one ot grieve
qivghu	to be sorry about a loss; to grieve over the loss of a loved one or cherished possession; to regret
qivlegte	to ransack; to dig into things making a mess of them
qivraagh	to complain; to fuss; to gripe
qiwaaghnga	to have short fur
qiwaagh	to be shear short (of fur)
qiyaaghqe	to intentionally make one cry
qiyaaghwagh	to cry very hard and long
qiyamllagte	to whine; to whimper
qiyanaruug	to be annoyed or hurt; to feel like crying
qiya	to cry (shed tears)
qiyengllegte	to sob; to cry lightly
qiyiqe	to cry off and on over a period of time; to weep
qiyvagniqe	to reach the limits
qugaghsiigh	to chop wood for fuel
qugagh	to club; hit hard; to affix a knife or ax into a piece of wood
qugakesingwaagh	to willfully ignore
qugake	to pay attention; to respond
qugakigate	to be inattentive; to be unresponsive
quganagh	to be disgraceful
qugaqu	to hit repeatedly; to peck (of a bird)
qugatagh	to hollow out
qugerngugh	to screech; to yelp; to smile frequently with laughter; to coo (baby’s sound)
qugeyegte	to giggle quietly (in excitement)
qughagh	to dangle; to hang down; to sag
qughaseketiigh	to dangle
qugiisigh	to pickle or ferment meat
qugili	to get fat
qugintagh	to be fat
qugtuqaghmig	to put into the baggy leg of old-fashioned bloomers with drawstrings at the knee
qugtuqaghmik	thing put into the baggy leg of oldfashioned bloomers with drawstrings at the knee
qukaayug	to boast
qukaghite	to get or place to the center of something; to reach the middle
qukaghte	to be halfway through; to fill halfway; to be at the middle of a time span (day, month, year, etc.)
qukasalegh	to be or hit right in the middle
qukfighte, qukfightagh-	to part the hair and pull back each half behind the ears; to open a book flat 
qukfighute	to make a V-shaped wake (when a boat moves across the water)
qulaghwaaghite	to be a spendthrift
quleghtaq	tarp fastened around gunwale of boat to keep water out; spray skirt
qulighwaaq	single strip of decoration on the bottom of  a snow shirt
qulighyak2	broth made from the liquid used when sealskin is processed to remove hair
quliiwhtaq	tarp fastened around gunwale of boat to keep water out; spray skirt
qulite	to wash one’s hair
qulleghrak	walrus skin used to cover a summer house
qullig	to put on pants
qullipigek	skin pants in contrast to cloth pants
qulliraaghek	cloth pants in contrast to skin pants
qulluk	commode; “honey bucket”; motor well in boat
qulmesighaq	a pot’s worth or quantity of tomcot
qulqesaati	to place a pot of food right above the flame to cook it quickly; to place wet clothing right above the flame to dry it quickly
qulqesaghqe	to get to the area above (it)
qulqisiigh	to elevate something from ground or floor; to raise
qulqite	to reach the top or the upper level
qumigagh	to climb pole using the legs; to shinny up a pole
qumig	to put inside front of parka
qumikesegagh	to sit with legs folded
quminge	to become pregnant
qumsegte	to close legs, scissors, jack knife, window, door or other hinged pair of things; to wink
qumsekegte	to get one's fingers or other body part or other thing pinched between two things
qunengllagh	to rock to sleep
qungangiite	to reach the center; to acculturate
qungevagh	to go further inwards or inland
qungllaagh	to part the hair in the middle
qunglug	to submerge (of seals, walrus, people)
qungragaghte	to chip; to crack; to split
qungsig	to be easily split for thread making (of sinew)
qungsugh	to rest after giving birth with one's legs flexed and upper body bent over them
qungughnagh	to be downcast, joyless
qungughte	to hang one's head down; to rest forehead on crossed arms
qungugh	to bury; to inter
qunguq	scruff of neck; top of back
qungvughaq*	minke whale (Balaenoptera acutorostrata)
qungyagh	to be envious; to be jealous
qungyaqe, qungyake-	to be envious or jealous of (him)
quniluugte	to become teary-eyed; to get tears all over one’s face
qunqalleg	to blink
qunqavyugte	to squint
quperghu	to cut alongside a small part of something
quperghuugh	to decorate front of sealskin water boots with narrow strips of bleached sealskin with waterproof seams
qupigh	to put on hair beads
qupughhagh	to have one's hair become wet and stringy
qupughhugh	to cut or split lengthwise; to rip (cut with the grain)
qupughragh	to split or cut into strips
qupugh	to split more than one thing
quqighnagh	to be peppy; to be full of energy
quqiigh	to attract the attention of a passerby by putting a stick up through the ceiling ventilator and making noise
quqquq	a signal to warn of animals appearing from water
qurimti	rock used (as balast?) to secure a boat from wind
qusevegnagh	to be modest or humble
qusevegte	to be modest or humble
qusighqe	to develop or cause cracks especially when weight is applied
qutenge	to reach the shore; to find land after being lost at sea
qutepik	mainland; dry safe land as opposed to rocks or marsh; Chukotka; Siberia
qutug	to snore
quugniigh	to look for firewood
quugsaghtugh	to look for firewood on the shore by boat
quugsiigh	to get firewood
quugte	to get firewood
quullimaqe	to look after someone’s health and wealth
quulqite	to reach the top or the upper level
quumsagte	to tower over
quumziigh	to gather kindling
quunqagh	to wink; to blink
quupaghte	to crack; to split
quupe	to split; to cut in two lengthwise
quupkagh	to be shocked; to be amazed
Quurkeli	hero/trickster raven (especially in Chukotkan stories)
quusqe	to pull up one's shoulders and pull down one's head; to shrug one's shoulders; to huddle up from cold
quuste	to pull up one's shoulders and pull down one's head; to shrug one's shoulders; to huddle up from cold
quuve	to decrease in size
quuvyug	to feel insecure or insignificant
quuyigh	for the wind to die down; to be without wind
quvluuki	to crumple up (garment or the like)
quyake	to be happy about
quyanagh	to cause happiness
quya	to be happy; to be joyous
quyiite	to be self-assured, self-confident, unafraid
Quyillegqaatfik	time in the fall when Eskimos go to the Chukchi to trade; around late August or early September
quyillegti	to speak Chukchi; to pack things on the back in a certain (Chukchi style) way
quyillgaaghti	to speak Chukchi
quyngighniigh	to herd reindeer
quyngighqwaagh	to herd reindeer
quyngilegti	to travel by reindeer-pulled sled
quyugh	to feel intimidated; to cower; to feel overwhelmed by a more powerful person
ragigu	to set up camp while traveling
ratamyaag	to put on waterproof summer boots
reghange	for it to start to get dark earlier
reghete	to peek in or out; to look through a small hole or crack or from behind something
reghighqe	to open wide; to break down (wall or the like) to make an opening
reghigh	to open partially; to pry up or open partially; to wake up
regla/regle-	to be nosy; to be curious; to be inquisitive
regra / regre-	to be nosy; to be curious; to be inquisitive
rekelta	long strap which is used to tighten roof of the traditional domeshaped house, the mangteghapik (q.v.)
repaqu	to hammer repeatedly
repa	to hit with a hammer; to hammer
reqiiwmete	to be bent; to be distorted
retwhaqu	to repeatedly bombard
retwha	to bombard with artillery
riiggni	to make a den (of an animal)
riigsi	to make a den (of an animal)
riirngi	to watch stealthily; to observe; to spy on
riirvak	one who has grown, started to reason and learned a lot; mature person
riistuniqe	to be frugal; to be overly parsimonious; to be stingy; to be very sly or sneaky
riistu	to be sly; to be stingy
rinimiwi	to be a hoarder
rinmiwi	to beg
ruughangi	to not hesitate to do or say something; to be outspoken 
Ruuseghmiik	river that flows into Tomname Lagoon on St. Lawrence Is.
saafqughwaagh	to run one’s or fingers hand over (it); to feel around
saafte	to touch; to feel
saagaghte	to suddenly unroll or otherwise spread out
saaghaghte	to suddenly happen
saaghw	area or space right next to something
saagmete	to be level, smooth, flat
saagragh	to uncoil; to smooth out; to spread out
saagsaate	to break its harness (of a dog)
saag	to get scattered; to get into disarray; to get spread out; to uncoil
saalghaghta	unexpected storm coming from any direction
saallgaghte	to scrape off accidently 
saallghaghte	for wind to change course suddenly get strong; for a storm to arise
saama	also; too; furthermore; moreover
saamna	that one down there; that one to the south or southwest 
saanighte	to age (of food)
saanqaghqe	to be face to face; to face
saape1	to cover
saape2	to drive (herd of reindeer) to a new place
saapghangite	to not be detered by cold (or other adverse conditions)
saapkute	to escape taking some of the hunting gear (of a sea mammal)
saaqghaghte	to accidentally or suddenly chip
saaqw	area or space next to or right by (it)
saaqwin	walrusskin cover of  summer tent from top to bottom
saaqwliq	something next to another; neighbor
saarma	to depend on something
saasaqe1	to try to attract attention; to seek a favor
saasaqe2	to put in an exposed place; to lay out
saasqagh	for wind to be coming straight in from the ocean; to be turned facing something
saasqaghmeraagh	to stay around whether appreciated or not
saasqaq	wind toward land from ocean
saatghwaagh	to wear a fur-side-in parka without a cloth cover
saavgumiigh	to prepare, get equipment ready, to harpoon the whale
saayguraaq	modern storm shed; entry porch
saaygu	tunnel entrance to semisubterranean house
safkaagh	to cover; to block (view)
safkeghyuug	to be in a bad mood; to feel frustated; to be angry
safkutaq	cover; windscreen or other shelter from wind; barrier to view; coverup of facts
safleg	to handle and examine permission; to "paw"; to rummage through (it)
saflengaq	one who likes to handle everything without permission
sagelmak	ruddy turnstone (Arenaria interpres)
saghefte	to anger
sagheme	to be very envious
sagheve	to crumble; to topple; to collapse
saghiigha	astonished; amazed
saghiighqe	to be enthusiastic; to act intensely
saghnasta	collector
saghna	to gather; to pick up (many thing); to collect
saghyughte	to get lots
sagiqe	to persist; to persevere; to insist; to urge on
sagniin, sagniita	twine sewn in along stitches of sole of skinboot to keep the thread from cutting into the skin
saguyaaghte	to turn when traveling; to take a side trip
saguyaghtaagh	to prepare a skin drum for use (as by moistening its skin)
sakegh	to cut in one stroke; to slash
sakemna	that one down there; that one to the west; that one in the outer room; that one toward Gambell from Savoonga; that one towards east (additional meaning in Chukotka)
sakenge	to catch fish or game; to get something; to buy something
sakeqe	to break in two (of rope, string, thread, wire, tape, etc.)
sakete	to make thinner
sakighte	to line up side by side
sakimak	chest (anatomical)
sakniqe	to exert oneself; to be forceful; to yearn for something; to be forceful; to be anxious
sakraa	to be frustrated; to be irritated; to be in a bad mood
sakrite	to be frustrated; to get irritated
sakusiiqe	to use in a careless and wasteful manner; to abuse; to mistreat; to oudo in sports
sakwaaqe	to treat as junk; to be careless with; to handle roughly; to look down on (a person); to outdo in an athletic contest
salagu	to club; to clobber; to hit with something thrown
salghutaq	pantry; storage place
sallagte	to clean in a rough, partial or preliminary way (e.g. a skin)
sallaqi	to have a comfortable life; to relax; to take it easy; to have time and opportunity to socialize
salleghte	to leave (after difficulty); to move forward
sallegpak	consolidated slush ice or new ice thin not quite thick enough to be safely walked on, can be broken up by the passage of a boat
sallegte	to scrape (especially fat from a skin)
sallek1	slush ice becoming consolidated; new ice not thick enough to walk on forming on calm water
sallgaaq	slush ice area just beginning to consolidate, after the qenu stage
sallghite	to be unbleminshed; to not have done anything
sallghwaaghhiite	to be in perfect condition
salligte	to scrape (especially fat from a skin)
salliigh	to travel through slush ice by boat
sallmag 	to patch a boot sole
sallmeg	to scrape one's skin accidently; to scrape the paint off something
sallughmete	to be cross-eyed; to be wall-eyed
salngak	box; suitcase; motor well in boat; coffin
salug	to be in desperate need of water to drink; to be dying of thirst
samataq	forehead ornament of iron given by shaman to patient as a remedy
sameghqe	to die without a trace due to an accident; to have a fatal accident away from a settlement
samillagh	to unsuccessfully do something (especially in hunting)
samitagh	to sneak up on
samleghagh	to be active
samlleghqe	to scratch; to abrade
sanaghte	to process a skin; to cure a skin; to tan a skin
sanamaqute	to prepare something; to get something ready
sanariigh	to procrastinate
sanghiighi	to recover; to perk up
sangighqugh	to wash dishes, hard surfaces, etc.; to wipe clean
sangigte	to wipe; to clean off (spilled liquid)
sangiighi	to recover from illness, mishap, etc.
sangiite	to be deprived (of); to not have any more of
sangunanigh	to be unconscious because of severe pain or a wound; to become delirious; to be totally exhausted; to be limp
sangyagh	to be hard to move or pull; to be slow at learning
sangyite	to not slide easily; to slow down due to rough ground or other adverse conditions
sanighhuwaagh	to roll about
sanightaaq	woman's fancy gutskin parka with dangling decorations sewn on in horizontal rows from the hood down to the hem
sanighyaq	barrier; crosspiece; obstruction; interruption to one's thoughts; mental obstruction; bar such as one put across a door to prevent entry; bar across  back of sled
sanighyigh	to bar entry; to interrupt one’s thoughts
saniite	to impede activity making it difficult or impossible; to not be conducive to acting
saniligh	to build addition or add onto side of building
sanitmiighte	to go sideways or to the side
sanivlegagh	to suddenly turn or skid sideways or to the side when moving
sanqun	equipment; tool; device; weapon; useful item
sanqutraaq	makeshift tool; crude device
santiyagh	to go to Sunday church service
sapaaslug	to enslave; to mistreat
sapayughhiite	to be alert; to be okay (of a person)
sapayungigh	to recover from illness; to regain consciousness; to perk up
sapeghhnagh	for weather to be very cold
sapegi	to lose game animal by its escaping
sapiiqe	to negatively experience extreme cold; to be overcome by extreme cold
sapughagh	to drive (a herd of reindeer) to a new place; to drive animal(s) in the desired direction by blocking other paths; to cover (it, them) repeatedly or continuously
saqaaghhiite	to be clearly visible
saqaaghiighute	to have one’s vision improve
saqeghqe, saqighqe-	to break to bits; to chip off in bits
saqeghte, saqighte-	to chip off a piece
saqeme	to crumble to pieces
saqfigh	toes turned out
saqfitu	to be splayfooted
saqighaghte	to accidentally or suddenly chip
saqipeg	to sweep; to rake; to scrape
saqralqaq	ice which, although still solid enough for walking, is such that footprints left on it fill with water; sea ice with watersaturated surface, hard to walk, sled or work on
saqrugaghte	to chip (of glass or the like)
saqumig	to hold in the crook of the arm with the arm held out and up; to hug; to embrace
saqumiite	to give one something of a size that could be carried in the crook of the arm
saquste	to glide to the side (of a bird)
sariigh	to hold competive event; to have entertainment; to celebrate
sarma	to brag
sasii	to be a practice (something one does habitually or from time to time); to be a device
sasiq	habit; device; practice; tool
sasiqumtaaq	predictable even; custom; customary practice
saste	to make one act or feel a certain way (generally, with a negative implication)
sategte	to clean the hairless side of an animal pelt; to clean the inside of a skin tent; to eat fish by stripping the meat off the skin; to clean summer-type hair-in sealskin boots
sateme	to comes loose from what it is fastened to (of a rope)
sa	to do what?; to do something
savegsite	to aim harpoon
saveg	to harpoon
savigh	for there to be whitecaps on the ocean and a strong current
savighhe	to whittle; to carve; to make red-hot
savigsigh	to sharpen; to get knife ready
savigsi	to get a knife ready for use
savigtaagh	to point knife at something or someone preparatory to attacking with it
savigtigh	to direct a knife preparatory to attacking with it
saviigh	to forge (metal); to make red hot
savik2	place, time or opportunity to do something
sayughqaagh	to become hard, strong and durable (of skin)
sayugh	to dance a set non-improvised Eskimo dance
sayugpagtagh	to pull with repeated jerks; to have a tremor; to have a tic; to twitch
sayugtaagh	to tug
sayug	to pull; to tug
sayuugte	to shrink or warp from drying; to feel tense; to be in a tall column (of clouds)
sefkaghte	to accidentally burst (as an overstuffed meat poke)
sefkagh	to accidentally cut or tear through (as to the edge when making a hole near the edge of a skin)
seflugpak	horn (as of a car); factory whistle
sefluqaghte	to pierce through
segefkagh	to make holes in something
segeghte	to become dry and brittle (of wood)
segeghte	to dry excessively and become brittle (of wood)
segeni	to decorate with reindeer or caribou chin hairs sewn on the  surface of a hide in a garment; to embroider with reindeer or caribou chin hairs
segeve	to wear through or almost through
segge	to cut open; to slash; to split open
seggute	to slam crash or plunge into something
segheve	to calm down; to diminish in intensity (of emotion)
seghevute	to forgive
seghhaagh	to hiss (of liquid on hot surface)
seghhaghute	to sizzle
seghhe	to sweat profusely; to gather condensation (on it); for dew to freeze (in fall time)
seghleghni	to feel bad (for a long time) about a situation
seghleghqe	to err; to make a mistake; to sin; to be in a very unfortunate situation
seghleghu	to be bad
seghleghyug	to feel bad (for a short time); to have hurt feelings
seghleliigh	to have a hard time; to grieve; to experience depression
seghleqe	to criticize; to dislike
seketeste	to set in (of fog)
sekete	to dunk or bury one's head in something; to bend way over forward (people, birds); to dip into something; to lower the head
sengelqagh	to hop on one leg
senglepegragh	to limp around
senglepegte	to limp
sengngugh	for overflow water to collect on lake or river ice 
seqemengeltagh	to exude liquid, especially blood, in bead-like form
seve	to cut or tear through cloth, skin, flesh, etc., especially starting from a hole
sevraquma	to be toothed (have sharp projections)
sevri	“threetoothed” bone in a fish head that can be fatal if swallowed
siftagh	to flatten; to plant one’s feet firmly on the floor; to crush
siftugh	to bury deeply
siftughughte	to be in a kneeling position (of dogs, wolves)
sighimake	to hope for
sighima	to hope; to have faith; to look forward to something
sighla	to act with strong emotion; to go fast; to get plenty of something; to act with intensity
sighute	to get buried or covered over by action of waves and sand
sigiin	new ice in previously open lead in ice field; refrozen lead, good to walk on
sigiqe	to break or shatter glass, eggshell, ceramic, etc.
sigugneq	ice on or near shore formed from slush brought to the shore by waves, piled up and possibly refreezing when the water recedes
sigutkegsi	to keep alert for important news
sigutkegsi	to stay alert for news; to “keep one’s ears open”
sigutkesi	to listen for something
sigutlug	to have an ear infection or earache
sigutqugh	to whisper into one's ear
siifte	to set a net, snare, or trap
siiggaghaghte	to degrade vision through condensation; to suddenly fog up
siigh	for weather to clear up; for fog, blizzard, or smoke to clear up, dissipate or pass
Siighmiik	creek flowing from the southeast side of the mountain behind Gambell to the south end of Troutman Lake
siighnaq	walrus stomach
siighni1	to prepare a walrus stomach for use as a bag
siighni2	to skip a stone across the surface of the water
siigte	to have diarrhea
siikaq	dried walrus stomach to be used as a drumskin
siiknegh	to be determined; to be persistent
siinge	to push; to shove
siingleghagh	to push continuously; to plane wood
siinguraq	ice floes floating close together in striplike formation near the land, may extend far, dangerous to walk on
siingvallaagh	to speak in anger or hatred
siingvallagha	to speak in an aggressive manner
siinqigute	to rinse
siinu	pantry; storeroom on either or both sides of the the insulated inner room of the traditional domeshaped house, the mangteghapik (q.v.)
siipgaghte	to accidentally strip something off
siipneq	excess; leftover
siipngaan	in abundance; enough to meet the need
siipngagh	to be in excess beyond …
siipniyug	to feel that something is sufficient; to feel superfluous
siipte	to have something left over; to have an excess
Siiqivak	projection of land into lagoon from barrier isthmus near west end of Koozata Lagoon on St. Lawrence Is.
siirgusiigh	to scramble eggs
sii 	to put drumskin on a drum; for a sheet of thin ice to form on the water
siklaate	to fall over or fall down (of a person, usually by tripping or slipping)
siklagh	to use a pick; to break through; to strike with tusks
sikmuute	to lunge forward; to fall forward; to die (slang)
sikuliiq	new thin sheet of sea ice just moved in to land; water that froze on top of ice making the ice thicker
sikupik	sheet of sea ice thick enough to walk on; regular ice
siku	to get covered with ice; to freeze over
silimuqa	to poison
silunge	to become fully fledged (of bird)
simigh	to change; to exchange; to replace
singagh	to kiss
singaghugh	to repeatedly kiss
singigh	to tie one's laces
singigrakegte	to have a sharp point
singig	to come to a point; be pointed
singikrak	summit of mountain; top of tree, mountain, etc.; tip
singilpayug	to tuck the laces of one’s boots in the top of the boots (due to being in a hurry)
singlepegte	to limp
sipegte	to strip the leaves from a stem; to remove liquid from an object (garment, skin, rope, etc.) by running it through the space between one's thumb and forefinger held together at the tips
sipetughii	to have a lot left over; to finish or arrive with time to spare
siqaghaghte	to accidently cut or scrape one’s hand or arm or the like
siqagh	to remove the frilly sides of a certain kind of kelp
siqallghaq	rag used to wipe spills
siqfallag	to splash
siqineghllugu	for it to be sunny
siqinghuugh	to get sunny
siqinitagha	to squint from the brightness of the sun
siqite	to splash (it) out
