aafkagh	to burst
neghqe	to feed (dogs, people, etc.)
neghqughruk	skeleton; very skinny person
neghqugh	to have rheumatism; to have arthritis; to ache in the bones and/or joints
neghuvaghsagh	to make soft and smooth
neghuvate	to be soft
neghyaghqangllagh	to prepare food
neghyugtaghagh	to dream about something; to always rely on somebody
neghyuke	to hope concerning (it)
neghyu	to hope; to expect
negifkaqu	to appear (of thawed patches)
negighqu	to cut out the various pieces needed to make something
negig	to cut out a piece of material or skin; to tear out of someone’s hands
negikragh	to cut out a pattern
negitughqe	to gasp when food goes down slowly after swallowing
negitughqwe 	to hiccup
negugh	to go around an obstacle; to avoid
neguqragh	to force one’s way
nekaghqaq	building site; place for something to be located
nekefqaghte	to jump up; to take off suddenly
nekefte	to build
nekeggneqigte	to restore; to put back in the appropriate place
nekegpagte	to creak; to change for the better
nekegsiilliqe	to worry; to play noisily
nekeve	to stand up
nekevgha	to be standing
nekga	to calm down; to stop rushing
nekgute	to bring something to its place; to put away; to put in the proper place
nekleg	to die down (of wind); to diminish (of a bad condition)
nekreg	to hook as with a gaff
nekrewaagh	to crochet
nekwaagh	to be settled down
nelegte	to put in place securely
nelgughte	to never move once one has stopped
neliite	to take up residence at (it, a house)
neli	to build; to establish a home
nellaaghqe	to drive out of one's home
nelliqe	to engage in unacceptable behavior
nemegh	to lash; to tie up; to stitch overcast
nemetwha	to stay home; to stay in one place; to be on one’s own
nengaawaq	a man who is working (according to custom) for the parents of the woman he will marry; sonin-law to be
nengaawiqe	to work for the parents of the woman one will marry
nengagh	to go off angrily or sulking; to stalk off
nengekeregiigh	to not reach something
nengenghigh	to tire, slow down and lose enthusiasm as from working too hard
nengerqagh	to stretch skin
nenge	to stretch; to tighten
nengighqe	to divide and distribute one's catch
nengigh	to receive a share of a catch which has been distributed
nenginaaqu	to be unable to proceed while traveling; be stuck in place
nengitugh	to have a hard time getting to the desired place or into the desired position or situation; to feel uncomfortable where or how one is
nengki	to prop up
nenglaghnagh	to be funny
nenglagh	to laugh
nenglaghyugsagh	to make fun of someone
nenglasiigh	to chuckle
nenglekegte	to be icy cold (of liquid or solid, not person or weather)
nenglengestagh	to giggle
nenglisigh	to cool off food
nengli	to cool off
nengllitaq	tooth that is abnormally sensitive to the cold
nenglliyug	to be abnormally sensitive to the cold
nenglliyug	to be sensitive to cold (especially of teeth)
nengpagte	to yank on a rope; to suddenly become angry and stay angry
nengqe	to be tense; to have a cramp; to have sore muscles
nengrugh	to have rheumatism
nengruuqi	to be reluctant to go out or go on a trip because the cold
nengsugpagtagh	to jerk uncontrollably
nengsugpagte	to strain a muscle; to make an injury worse
nengte	to stretch (it)
nengughte	to get married; to become populated
nengug	to reach across; to tug
nengugutiiraagh	to vote
nengukagh	to snatch; to strike with hand or fist
nengulgha	for waves to break on the beach; for surf to come up and sweep across beach after waves break
nengumaste	to be the head of a household; to lead the household
nenguugte	for wind to get stronger
nenguwaagh	to grope sexually
nenguyugte	to live somewhere as if in one’s own home
nengwaaqe	to live somewhere as if in one’s own home
nengzighhe	to stretch one's body as upon waking
nenki	to prop up
nepasanagh	to be misty or drizzly
nepiigh	to become silent
nepite	to be unintelligible; to speak with an impairment
nepititaghte	to bring a boat (or the like) from the breakers and to secure it
nepneqagh	to stick (it -- knife, axe, etc.) into or onto something when not in use
neprakegtagh	to lack self-control
nepsaate	to get dirty; to get soaking wet
nepsag	to soak or sop up liquid
neptaarakegte	to tend to try to dominate a conversation; to tend to speak without thinking through what one will say
nepte	to dip into water or other liquid
neqagh	to recall; to remember
neqamike	to remember (without having forgotten); to not forget
neqangisag	to run short of food; to suffer famine
neqangugh	to think of; to remember
neqekrangllagh	to bake bread; to make fried bread
neqelghutaq	cache; storage place for food
neqenghaghqe	to hold a feast
neqengyu	to be a good hunter
neqesupa	glutton
neqete	to catch fish or game; to obtain food
neqiinagh	to eat without further ado
neqligh	to poison
neqlightugh	to offer food
neqnigh	to be tasty
neqniilliqe	to not enjoy eating
neqniite	to not be tasty
neqniqe	to find tasty
netuughnagh	to be frustrating or discouraging
netuughniqe	to feel discouraged or frustrated
nevagha	to be sticky
nevesqaghneq	chunk of ice or floe loosely adhering to edge of sea ice floe or field
neve	to stick; to cling; to adhere
neveyeghnite	to be sticky; to be gummy
nevligh1	to notch
nevligh2	to return to a certain way of doing things
nevngig	to easily stick on something; to be sticky
nevuute	to stick to something; to stick to each other
ngaayuun	condition wherein floes crowd densely together making boat passage difficult and dangerous
ngaayuute	to be blocked by chunks of floating sea ice
ngepeghte	to go directly to a place without stopping
ngepghute	to surface (of whales)
ngevreghagte	to be smooth and shiny
ngevyeg	to pinch or scratch with fingernails
ngiiggun, ngiiggutaq	weight put on top of something to hold it in place
ngiigte	to put weight (including part one’s body) on something to hold it in place
ngiillginagh	to want to go somewhere or do something but be unable to because doing something else
ngiiqe	to bend over from carrying a heavy load, due to head wind, or due to dragging something by a rope stretching back over the shoulder
ngillegte	to moan; to groan
nguleghte	to stretch (particularly a boot sole) with a stretching stick
nguug	to eat meat clinging to a bone (said of an animal)
nighugpagte	to twinkle
nighugtaghagh	for dawn to come
nighugte	to become bright
nighug	to be bright (light); to be daylight
nighugyug	to get bright light in one's eyes
nighupagite	to be dim or dull
nighwaagpagtagh	to glitter
nighwaagrag	to be transparent
niighigh	to remove rope holding a skin to a drying frame (and thus remove the skin); to debone a fish
niighte	to crush; to press; to lean heavily on
niigh	to place sticks side by side as when making an elevated rack
niightugh	to stretch and lash a skin to a frame for drying
niilquta	rope used to fasten skin onto drying frame
niinghute	to surface and then resubmerge (of sea animal or boat in rough water); to plunge into something
niita, niin	lashing of baby walrus hide holding skin to boat frame; rack hanging from ceiling of house used for drying clothes or storage                                                                                                                                                                                                                                                                                                                                                                                                                                                                                                                                                                                                                                                                                                                                                                   
niite	to have a fishbone stuck in one's throat
niive	to transfer from one container to another; to pour; to give birth
nipallagh	to be offended (as from being left out); to feel left out; to be emotionally hurt
nipallaqe	to be offended or emotionally hurt by (it)
nipalliqe	to feel left out
nivugh	to pour into another container
nughtuqite	to be deterred from doing what one had intended
nugru	to put a loop in something
nugyaghaq	entryway to tunnel (saaygu) of semisubterranean house (nenglu)
nukaq	stone or iron scraper
nukeggnaghqe	to get dirty
nukeggnagh	to cause one to get dirty
nukeggniigh	to clean
nula	to multiply; to increase in number or size
nulgiigh, nulngiigh-	to relax facial muscles; to become expressionless; to become stony-faced
nulgiite, nulngiite-	to be stony-faced; be expressionless
nulightugh	to get a wife; to get married (of a man)
nuliighqaq	wifeto-be
nullu	rump; buttock; upper part of hill or mountain
nulqaviigh	to have a difficult time; to be worried or discouraged
nulugh	to fish through the ice by jigging; to jig; to ice-fish; to dunk teabag up and down
Nunaagek	Stolbi Rocks off the northeast coast of St. Lawrence Is.
nunaaq	camp; village; town; city
nunakingite	to be indisposed or otherwise unable to enjoy things
nunaki	to have a good time; to enjoy oneself; to be happy
nunangite	to not have enough room
nunanighqe	to produce enjoyable music, stories, etc.
nunanigh	to be enjoyable
nunanipagite	to be not very enjoyable
nunaniq	cause of joy; enjoyable thing (music, story, etc.)
nunaniqe	to find (it) enjoyable
nunatu	to be roomy; to be spacious
nunavghugh	to go camping by boat for an extended time
nunavghuugh	to go to a camp
nungighsiitet	stitches which form the tube for a drawstring around the top of a skinboot
nungighte	to tie boot top or other clothing with a drawstring
nungyaghaq	entryway to tunnel (saaygu) of semisubterranean house (nenglu)
nunii	to sit very still and stare vacantly; to daydream in a trance like state
nunivi	to gather greens
nunmaaw, nunmaag-	to be slow; to be sluggish
nunugh	to pinch; to hold between thumb and finger(s)
nunughtugh	to choke; to strangle
nuqeghsigh	to take a shortcut in order to overtake what one is pursuing
nuqete	to have fortitude; to practice self-restraint; to refrain
nuqnegh	to hold on (lest one fall)
nuqsaleg	to almost but not quite obtain (it); to fall short
nuqutughte	to widen
nuqutu	to be wide (of clothing, openings, etc.)
nurgu	to put a loop in something
nusughagh	to pass through an area of thin ice by breaking it before one as one goes
nusugniigh	to snare; to trap
nusugteqaq	loop (to make a knot easy to untie (as the loops made when tying a shoelace))
nusug	to pull out
nutaghte	to make new; to renew or be renewed; to fix up
nuugaghte	to move suddenly; to change one's mind suddenly
nuughhute	to be insufficient
nuughqaghte	to suddenly protrude through an opening; to suddenly surface; to suddenly put one’s head through an opening
nuugh	to be in need; to be unable to reach; be short of; to miss out on
nuughtugh	to miss (be too late for)
nuugpagte	to move suddenly; to change one's mind suddenly
nuugte	to move
nuug	to surface (of seals, ducks); to stick one's head out through an opening
nuulgaghte	to chip the edge or tip of (it); to break off a piece from its edge or point
nuupnigh	to abate or diminish or die down temporarily (of wind)
nuuqragti	to live in poverty
nuuve	to run thread through the eye of a needle (or like thing); to thread (a needle); to do something correctly (figurative usage)
nuvagragh	to moisten with saliva
nuvag	to drool
nuverragh	to knit; to thread through
nuvugh	to string beads
nuyaaghite	to not be timid (of animals)
nuyaagh	to be timid; to be wary; be unapproachable (of animals)
nuyiigh	to get or give a haircut
nuyiite	to be bald
nuyileq	ice field that is beginning to break up with narrow open leads
nuyughtugh	to be timid; to be wary; to be shy (said of animals or people)
paaghqata	belt fastened crisscross on to a long-handled dipnet
paaghqite	to be vacant; to be unpopulated; to be without people
paagh	to lick clean with the tongue; to scrape with one's finger and lick off the finger; to lap with the tongue
paagna	that one up there, away from the water or up above; that one to the north
paallitaqe	to be inconsiderate of (him)
paallnaghqengwaagh	to suffer severe loss (of loved ones, property, health, etc.); to completely run out of something; to go broke
paame	to pump
paamkagh	to shoot with a whaling gun
paamna	that one up there; that one to the north; Chukotka from the viewpoint of St. Lawrence Island; that one behind; back of a person
paani	to work on something but not to completion; to outline or rough-out ivory carving or the like
paaptaaye	to baptise
paaqngite	to be deserted, uninhabited, empty, vacant
paarghu	appendix (anatomical)
paarghulliqe	to have appendicitis
paaskaghqaq	strip of skin or fabric for top of skinboot; edging material for use around an opening
paasqutaq	bag made from two sealskins sewn together
paasqute	to face each other
paawagh	to peg out a sealskin on tthe ground to dry
paawaq	sealskin pegged out on  the ground to dry
paayghaate	to break something when it is still new
paayngute	to begin (a trend, activity, ceremony, etc.); to start (a trend, activity, ceremony, etc.); to open a ceremony
paggaagte1	to audibly breathe hard
paggaagte2	to be filled with air; to be bloated
paghqigh	to learn; to discover (how)
paghqilngaate	to steal or slip away; to do, encounter or experience something when no one else is around
paghsi	to be sleepy or to sleep soundly after being out in the fresh air
paghyanghaghte	to catch or get caught, force or be forced to act when one is unprepared; to rush when unprepared
paghyugh	to be tired; to be sleepy
pagiqe	to nurse; to take care of
pagite	to leave as an inheritance; to keep as a keepsake of someone; to take care of for the owner when owner is away
pagi	to stay behind; to remain (to watch over things, as a survivor, etc.)
pagsinga	to attend; to be present; to watch something (a performance or the like); to watch stealthily (?)
pagugh	for there to be a ripple in the distance on the surface of the sea
pagulangigh	to dust; to filter (liquid)
paguluqe	to be murky, cloudy or dim
pakag	to pry with a lever; to raise, push or remove part by prying
pakegte	to bend or flex at a joint; to bend over forward; to roll up something
pakeg	to flex; to bend; to fold; to be bent by old age
pakestiya	rope running from gunnel to mast of boat
pakigniigh	to get more than intended
pakigsigh	to be stepped on or pushed aside by others in their striving to get ahead
pakig	to hook one's hand onto (it) and pull either bringing it toward oneself or pulling oneself toward it or past it; to grab much for oneself; to dismiss from the mind; to ignore or pass over
pakineg	to scratch
pakreghqe	to huddle up from cold; to tense up
pakregneq	narrow curved neck of a dried walrus stomach; duodenum; nonanatomical elbow
pakreg	to bend; to curl; to warp; to fold
palaghhaghte	to not get or give enough; to shorchange or be shortchanged; to decrease in amount; to become fewer
palaghmete	to be small, poor or weak; to be young and helpless; to be few
palaghte	to pacify; to appease temporarily
palaghute	to not get or give enough; to shorchange or be shortchanged; to decrease in amount; to become fewer
palaghyug	to feel slighted; to feel that one hasn’t received his due
palaghyuke	to regard as insufficient or inferior
palaqanin	lesser; little bit; not too much
palaqetagh	to not want to help out
palaqe	to regard as insufficient or inferior
palaqiigate	to not pay attention or give consideration
palighte	to fade; to (sun)tan
paligh 	to turn autumn colors; to suntan; to ripen
palleg	to brush off snow, dirt or spiritual contamination
pallnaghqe	to end; to be worn out; to be exhausted
pallugte	to thrash around in the water; to toss and turn in one's sleep
palngeri	to attend an event; to go and check on an event
palughtaq	sea otter (Enhydra lutris); beaver (Castor canadensis)
palutigh	to brace
pama	to flicker (of flame); to be disheveled (of hair)
panaaghaq	toy, little or makeshift spear; peg used to anchor to the ice a walrus carcuss in water
panasiigh	to prepare spear for striking
pana	to spear; to sting (of bee)
paneghte	to burn (it); to fry or stir-fry (it)
panegh	to starve to death; to burn; to burn up
pangalegti	to go fast with dogteam
pangaleg	to run on four legs (of animals) with front legs hitting the ground simultaneously
pangalwaagh	to trot
pangeghte	to take a trip to Chukotka from St. Lawrence Is.
pangeq	visitor from Chukotka to St. Lawrence Is.
pangquqe	to go check on; to pay a visit to; to check the ones left behind
panqallag	to char; to smolder; to scorch; to singe
panqugni	to complain of having little in order to evoke pity
panquugni	to pretend to be poorer than one is; to be stingy
panrengi	to get closer to see what is happening
panrengi	to look more closely at something
papaghnaq	boiled dried meat stored with fat in sealskin bag in preparation for winter
papallugh	to twitch; to fidget; to act excitedly
papasqitagh	to move tail back and forth (of a fish (or whale?))
paperaghte	to wag the tail; to swish the tail
paperegte	to wag the tail; to swish the tail
papi	dried seal meat that had been cooked and stored in a sealskin poke with seal oil
paprangite	to be quick, vigorous or active; to move fast
papri	to fidget
paqnamiqe	to escape or barely avoid peril; to warn or frighten one so that he will avoid peril 
paqnasigh	to come to someone’s aid to prevent injury
paqniite	to be foolhardy; to take chances
paqugaghte	to come off
paqumiyug	to be wary of and hesitate to act due to threatening weather
paraaghniigh	to ask for (needed item(s))
pasike	to blame; to find fault with; to accuse
pasingatke	to be interested in
pasinguk	area of face to the side of the nose near the nostril
pasleghhughagh	to hint to be given something
patagagh	to repeatedly pat or knock; clap
patag	to pat lightly; to knock on something
patalaa	to be in desperate need
patala	however it wasn't possible to do as asked
pategh1	to drain; to dry up; to evaporate; to be exhausted or tired
pateghte	to absorb
pateghtu	to be wide
pategmig	to drive off by slapping
pateg	to hit with palm of hand; to slap
patilngu	to ache (of  bone)
patime	to flap wings while on the surface of the water
patimlla	to flap wings at intervals
pati	to crack bones and eat the marrow within
patug	to become covered with a sheet of ice
payaaqe	to put on or wear woman's fancy knee-high bleached sealskin boot
payangite	for St. Lawrence Islanders to be visiting (Chukotka) or for Chukotkans to be visiting (St. Lawrence Island); people come over from the other side
payegh	to meet partway; to go to meet or to help (someone approaching the house or the village)
payghiiqute	to challenge in a spear throwing contest
payghumiigh	to go towards each other
payugte1	to go check on (him/her) concerning (his/her) well-being
payugte2	to raise the head from a lying position
payukagh	to check briefly; to look in on
payukagh	to raise one’s head and then lower it
paywaaqeke	to feel hesitant, unsure, frustrated or hopeless about (it)
paywaaqe	to feel hesitant, frustrated or hopeless due to anticipated difficulties
peggaghtugh	to stay up late
pegge	to stay awake all night
peghhe	to squat down (and give up) from exhaustion or cold
peghhigh	to wash one’s hands
peghhiisiq	hand washing implement such as towel, water or soap
peghhuughqe	to get one's hands dirty
peghlaaghwaq	traditional men's contest where competitors crouch down and jump to a drumbeat until exhausted
peghleghte	to become numb
peghlegh	to squat; to collapse; to be bent or stiff from cold; to be paralyzed in the legs
peghqigh	to study; to practice; to train; to learn
peghqigsagh	to train; to practice; to drill
peghqiiraagh	to fold over several times
peghqiiragh	to fold over and over
peghqinegh	to be wise; to be clever
peghqiniqe	to be sly; to be tricky
peghqipaari	to become expert
peghte	to fold over; to bend over
peghu	to bury; to inter; to cover over (especially with earth or snow)
peghwaaghi	to bury food to age or store it
peghwaaq	something buried or covered; something stored or aged underground
peghyi	snowdrift on the way after a storm
peghyugh	to be tired; to be sleepy
peglleghqe	to separate fighting people or animals
peglleghqute	to separate fighting people or animals
pegnefqagh	to almost finish or do something
pegnefqe	to miss but not by much; to almost hit the spot at which one is aiming
pegte	to release; to let go; to divorce; to set free
pegtirake	to not take care of; to not look after; to neglect
pegya	to leave unattended; to forget; to leave behind accidentally; to lose
pegyeghqe	to expose to public view; to bring into the open; to reveal; to throw into disarray
pekagh	to pant; to gasp; to suffocate; to be out of breath; to down
pekaghyug	to have trouble breathing
pekeqe	to carelessly dig; to mess up the ground; to unearth (literally or figuratively)
pekete	to shovel; to fire from work
pekfig	to ransack; to dig around in
pekighqu	to dig around in things; to yank
pekneq	sweettasting tuber of tall cottongrass plant (Eriophorum angustifolium). taken from mouse (vole) caches
peksag	to scatter things
peksigaghte	to rip apart; to pull apart; to pry apart; to break up snow or ground
pekug1	to disperse quickly
pekug2	to become fully awake; to become alert from a groggy state
pelaaya, pelaaye-	to play cards
pelataqute	to scatter
peleghqe	to get seriously injured; to die due to accident
peleghqii	to have a death in the family
peleqeyengiigh	to improperly finish a task; to do a careless job
pelghute	to agree on; to be favorable for; to be suitable
pelime	to shatter; to crumble; to fall apart; to break into many pieces
pelimte	to break into pieces
pelkwaagh	to become unaware of one’s surrounding; to be distracted from one’s surroundings; to not pay attention; to wander around
pellallaagh	to blow out air with the lips closed together making a noise (as babies and small children do)
pellangghite	to disperse
pellegh	to come apart (especially along a line of some sort through the middle); to fall apart; to separate; to divide; to go in separate ways
pellghute	to part from each other; to divorce; to put aside for
pelliili	to entertain; to give moral support; to keep (one) from being lonely
pelliite	to be good company; to be interesting; to cause one to be cheerful
pellug	to scrape dried fat off a skin of a small animal after the skin has been dried and in so doing to stretch and soften the skin; to process frozen greens by a scraping action
pelluk1	skinscraping tool worked with both hands and resembling a spokeshave
pellumghute	to fall into soft surface as of snow
pelungigh	to clean up
pelungite	to be clean; to be tidy
pelwetemnakun	file (hand tool); rasp
pengeg	to worry about someone who hasn't returned as expected or who is far away
pengekragti	to watch out for (because of worry)
pengetaagte	for surface or ice or ground to be bumpy
peng'gu	to worry about; to be concerned about
pengke	to worry about
pengugaghte	for a bump to form from an injury; for a small hill to form
pengugh	to swell or rise in a lump, bumpor hump
penitet	leaf tobacco bunch
pennaghniigh	to gather eggs from a cliff or engage in other cliffside activities
pennaghqute	to fall down from a cliff
peqigte	to figure out
peqligh1	to harden with age (especially of skins)
peqligh2	to deny having something (which one may or may not have)
peqlighte	to harden with age (especially of skins)
peqliqe	to deny having something (which one may or may not have)
pequ	unstable area in ice field where current causes ice to heave or break up leaving dangerous open water covered by thin ice or snow
peraagha	for weather to be suitable for hunting
perqi1	to not want to do anything because of the cold
perqi2	to become twisted or bent probably from arthritis (of dog’s leg(s)); to be rheumatic or arthritic (of dogs)
perutku	snuff box or other tobacco container
pesalli	to have difficulty finding something
pesallngugha	to have difficulty breathing (in water as when overboard)
pesiqagh	to eat walrus in frozen bite-size pieces
peskug	to slip off (as a rope off something to which it is fastened); to come to an end (anger, sadness, etc.)
petekesengiigh	to tiptoe
petgagha	to bounce repeatedly
petga, petgagh-	to bounce
petgayu	to be bouncy
petgeghinagh	to have difficulty getting something
petgegh	to bounce off something
petug	to tie so as to keep in place; to tether; to fasten
pezighmete1	to be totally thawed
pezighmete2	to be red; to be light-brown (of hair)
pezighte	to heat kelp for eating
pigraghaasi	to act to benefit someone’s belongings
piifqe	to get things ready as for a ceremony
piifte	to set out for use
piighaghte	to go, say, or act quickly
piighataaghagh	to get better; to improve
piighhaq	braided thing; whale sinew braided into heavy cord for sewing skin boat covers
piighhe	to braid
piighqutagh	to slap the water with a piece of baleen to get walrus excited and come to the surface
piighqutaq	striker of baleen used to strike water to attract sea mammals
piighqwaghate	to go to help a boat that has caught a whale
piighwagh	to chase game by boat; to approach game on ice by boat
piighwneq	draft coming into warm house as a vapor from the outside cold when the door is opened in winter
piignga	to protrude; to stick out
piig	to tear
piigugh	to tear up
piikna	that one up there above; that one up from the water; that one to the north (additional meaning in Chukotka)
piimsug	to pick all the meat from a bone and eat it; to completely eat the last meat that is clinging to a bone; to pick clean
piineqe	to paint
piinligh	to begin; to start
piinliin	onset; first thing; beginning; introduction (as to a book)
piinlilleq	introduction (as to a book)
piinpaghqe	to get a large wound or serious injury
piisqaghte	to jump out of the water
piiste	to project; to stick out
piitaq	bone with meat to be picked off and eaten
piite1	to pick the meat meat from a bone and eat it; to eat the last meat that is clinging to a bone
piite2	to come into view or into existence; to sprout; to rise (of the sun); for there to be a noon moon or for the month to start
piitesighagh	to plant; to sow
